title,price,type
 Sony CPJ-200 LCD Projector Projector Analog RCA Speaker Small Rarity ,92.26,Buy it now
5 GENUINE OEM JVC PK-L2313U LAMPS FOR DLA-VS2200 DLA-VS2200Z VS2200 VS2200Z 2LU,94.21,or Best Offer
GENUINE OEM JVC PK-L2313U BULB FOR DLA-VS2200 DLA-VS2200Z VS2200 VS2200Z 2LU,33.93,Buy it now
GENUINE OEM JVC PK-L2313U BULB FOR DLA-VS2200 DLA-VS2200Z VS2200 VS2200Z 3LV,33.98,Buy it now
GENUINE OEM JVC PK-L2313U LAMP FOR DLA-VS2200 DLA-VS2200Z VS2200 VS2200Z 1LV,33.93,Buy it now
GENUINE OEM JVC PK-L2313U LAMP FOR DLA-VS2200 DLA-VS2200Z VS2200 VS2200Z 2LU,33.93,or Best Offer
Genuine Epson Original Projector Lamp Bulb for JVC LX-D3000Z LX-D3000ZU Housing,58.61,Was: £65.85  11% off
Genuine JVC BHL-5006-S Original Projector Lamp Bulb with Housing,37.39,Was: £42.01  11% off
Genuine OEM Epson Original Projector Bulb Lamp for JVC LX-D1020 with Housing,34.74,Was: £39.04  11% off
Genuine OEM JVC PK-L3715U1 PK-L3715UW Projector Lamp Bulb With Housing Original,133.17,Was: £149.63  11% off
JVC DLA-HD750 HD Projector THX Good Condition Fully Working RRP £5000+ Remote,82.0,auction
JVC DLA-QX1G Original OEM Power Cable FREE SHIPPING,64.16,Buy it now
JVC DLA-X/RS Series Projector Chassis Parts White Conversion Kit,152.74,Buy it now
New listingMini Projector Full HD 1080P Small Cinema Video Projector Movie Home PC,146.87,RRP £160.58  9% off
New listingSony LCD Data Projector VPL-X600E. RRP£1100. ,14.99,auction
OEM SONY VPLL-ZM42 Projection Lens for the VPL-F Series Projectors,94.39,Buy it now
"Projector Video Projector SONY VPL-X600E, JAPAN",152.74,or Best Offer
RARE JVC RM-MQX1G Projector Remote Control Works With JVC DLA-QX1G & Others,64.16,Buy it now
"SONY VSL- DS100 Data Projector  - Working, please read details carefully",29.99,Buy it now
Sony VPL-CW255 Conference Room Projector Lamp: 8 hour - Used; No accessories,96.0,or Best Offer
Sony VPL-CW255 Conference Room Projector Lamp:2473 hours - Used; No accessories,96.0,or Best Offer
Sony VPL-FH30 Data Projector,90.0,auction
Sony WXGA VPL- FW300L Projector Cooling Fans,70.8,or Best Offer
Victor JVC 3D synchro emitter for home theater projector PK-EM2 Black,84.3,or Best Offer
jvc projector dlars4910 lca9034 good used pcb,65.14,or Best Offer
