title,price,type
 Sony CPJ-200 LCD Projector Projector Analog RCA Speaker Small Rarity ,91.89,Buy it now
5 GENUINE OEM JVC PK-L2313U LAMPS FOR DLA-VS2200 DLA-VS2200Z VS2200 VS2200Z 2LU,92.97,or Best Offer
"BHL-5009-S Replacement Lamp for JVC Projectors DLA-HD10, DLA-RS2, DLA-VS2000",21.18,Was: £30.26  30% off
GENUINE OEM JVC PK-L2313U BULB FOR DLA-VS2200 DLA-VS2200Z VS2200 VS2200Z 2LU,33.48,Buy it now
GENUINE OEM JVC PK-L2313U BULB FOR DLA-VS2200 DLA-VS2200Z VS2200 VS2200Z 3LV,33.53,Buy it now
GENUINE OEM JVC PK-L2313U LAMP FOR DLA-VS2200 DLA-VS2200Z VS2200 VS2200Z 1LV,33.48,Buy it now
GENUINE OEM JVC PK-L2313U LAMP FOR DLA-VS2200 DLA-VS2200Z VS2200 VS2200Z 2LU,33.48,or Best Offer
Genuine Epson Original Projector Lamp Bulb for JVC LX-D3000Z LX-D3000ZU Housing,57.83,Was: £64.98  11% off
Genuine JVC BHL-5006-S Original Projector Lamp Bulb with Housing,36.9,Was: £41.45  11% off
Genuine OEM Epson Original Projector Bulb Lamp for JVC LX-D1020 with Housing,34.28,Was: £38.52  11% off
Genuine OEM JVC PK-L3715U1 PK-L3715UW Projector Lamp Bulb With Housing Original,131.42,Was: £147.65  11% off
JVC DLA-QX1G Original OEM Power Cable FREE SHIPPING,63.31,Buy it now
JVC DLA-X/RS Series Projector Chassis Parts White Conversion Kit,152.13,Buy it now
New listingSony VPL CX21 Portable Projector,60.0,Buy it now
OEM SONY VPLL-ZM42 Projection Lens for the VPL-F Series Projectors,93.15,Buy it now
"Projector Video Projector SONY VPL-X600E, JAPAN",152.13,or Best Offer
RARE JVC RM-MQX1G Projector Remote Control Works With JVC DLA-QX1G & Others,63.31,Buy it now
SONY DATA PROJECTOR VPL-CX70 NOT TESTED,18.0,auction
SONY MP-CD1 Mobile Projector Black Pocket Sized w/AC-UUD12 Used From Japan,171.67,Buy it now
SONY VW320ES 4K Projector LCD PANEL SXRD851 C(GQ),111.79,Buy it now
Sony Data Projector VPL-EX175Charity item,39.95,auction
Sony Projector Made In Japan. Remote Control. Hakuba Metallic Case,65.0,or Best Offer
"Sony VPL-FHZ65 Projector, White",0.99,auction
Sony VPL-FW41 WXGA Conference Room Projector 1812 HRS No Remot Control,20.0,auction
Sony VPL-PX1 Projector DATA Projector,68.07,auction
Sony VPL-SW125 Conference Room Projector Lamp:1155 hours - USED,114.0,or Best Offer
Sony WXGA VPL- FW300L Projector Cooling Fans,69.87,or Best Offer
jvc projector dlars4910 lca9034 good used pcb,64.28,or Best Offer
