title,price,type
 Sony CPJ-200 LCD Projector Projector Analog RCA Speaker Small Rarity ,142.57,Buy it now
5 GENUINE OEM JVC PK-L2313U LAMPS FOR DLA-VS2200 DLA-VS2200Z VS2200 VS2200Z 2LU,93.9,or Best Offer
"BHL-5009-S Replacement Lamp for JVC Projectors DLA-HD10, DLA-RS2, DLA-VS2000",25.39,Was: £33.86  25% off
GENUINE OEM JVC PK-L2313U BULB FOR DLA-VS2200 DLA-VS2200Z VS2200 VS2200Z 2LU,33.81,Buy it now
GENUINE OEM JVC PK-L2313U BULB FOR DLA-VS2200 DLA-VS2200Z VS2200 VS2200Z 3LV,33.86,Buy it now
GENUINE OEM JVC PK-L2313U LAMP FOR DLA-VS2200 DLA-VS2200Z VS2200 VS2200Z 1LV,33.81,Buy it now
GENUINE OEM JVC PK-L2313U LAMP FOR DLA-VS2200 DLA-VS2200Z VS2200 VS2200Z 2LU,33.81,or Best Offer
"GENUINE ORIGINAL OEM JVC PK-L2312U LAMP FOR DLA-RS4810U, DLA-X35 1LV",37.59,or Best Offer
Genuine Epson Original Projector Lamp Bulb for JVC LX-D3000Z LX-D3000ZU Housing,58.41,Was: £65.62  11% off
Genuine JVC BHL-5006-S Original Projector Lamp Bulb with Housing,37.27,Was: £41.87  11% off
Genuine OEM Epson Original Projector Bulb Lamp for JVC LX-D1020 with Housing,34.62,Was: £38.90  11% off
JVC DLA-QX1G Original OEM Power Cable FREE SHIPPING,65.85,Buy it now
JVC DLA-X/RS Series Projector Chassis Parts White Conversion Kit,152.82,Buy it now
New listingJVC Projector. DLA-X30WE. HDMI. Working. Read description.,19.99,auction
OEM SONY VPLL-ZM42 Projection Lens for the VPL-F Series Projectors,94.08,Buy it now
Projector Lamp Sony VPL-VW11HT,150.0,"Time left2d 9h left (Sun, 04:15)"
"Projector Video Projector SONY VPL-X600E, JAPAN",152.82,or Best Offer
RARE JVC RM-MQX1G Projector Remote Control Works With JVC DLA-QX1G & Others,65.85,Buy it now
SONY DATA PROJECTOR VPL-CX70 NOT TESTED,18.0,auction
Sony Cineza Projector System,150.0,Buy it now
Sony LCD Data Projector VPL-X600E. RRP£1100. ,17.99,auction
Sony Projector White - RS-232C Home Cinema Movie Projector - RCA retro gaming,35.74,Was: £54.99  35% off
"Sony VLP-EX235 3029 Lamp Hours, Projector. Inc. Remote.",133.34,Buy it now
Sony VPL-PX1 Projector DATA Projector,68.38,auction
Sony WXGA VPL- FW300L Projector Cooling Fans,70.56,or Best Offer
jvc projector dlars4910 lca9034 good used pcb,64.92,or Best Offer
projector lamp for SONY XL-2400,5.0,auction
projector lamp for SONY XL-2400,7.0,"Time left5d 11h left (Wed, 06:32)"
