title,price,type
Sony VPL-HW55ES Full HD 3D SXRD Home Theater Projector with Remote and 3D Glasse,155.0,auction
New listingprojector lamp for SONY XL-2400,5.0,auction
New listingSony Data Projector VPL - EX226,75.0,auction
New listingSony VPL-CX5 LCD Projector with case. No Remote VGA & Video Cables Working USED,29.0,auction
New listingSony VPL-HW55ES HDMI Projector,100.0,auction
Sony VPL-CX5 Projector,45.0,auction
"GENUINE ORIGINAL OEM JVC PK-L2312U LAMP FOR DLA-RS4810U, DLA-X35 1LV",37.6,or Best Offer
"BHL-5009-S Replacement Lamp for JVC Projectors DLA-HD10, DLA-RS2, DLA-VS2000",27.1,Was: £33.87  20% off
Genuine OEM Epson Original Projector Bulb Lamp for JVC LX-D1020 with Housing,34.63,Was: £38.92  11% off
Genuine JVC BHL-5006-S Original Projector Lamp Bulb with Housing,37.28,Was: £41.88  11% off
RARE JVC RM-MQX1G Projector Remote Control Works With JVC DLA-QX1G & Others,65.87,Buy it now
JVC DLA-QX1G Original OEM Power Cable FREE SHIPPING,65.87,Buy it now
Genuine Epson Original Projector Lamp Bulb for JVC LX-D3000Z LX-D3000ZU Housing,58.43,Was: £65.64  11% off
jvc projector dlars4910 lca9034 good used pcb,64.94,or Best Offer
5 GENUINE OEM JVC PK-L2313U LAMPS FOR DLA-VS2200 DLA-VS2200Z VS2200 VS2200Z 2LU,93.93,or Best Offer
JVC DLA-X/RS Series Projector Chassis Parts White Conversion Kit,153.85,Buy it now
Sony Projector VPL-CS1,100.0,or Best Offer
 Sony CPJ-200 LCD Projector Projector Analog RCA Speaker Small Rarity ,154.89,Buy it now
"Sony VLP-EX235 3029 Lamp Hours, Projector. Inc. Remote.",134.23,Buy it now
New listingprojector lamp for SONY XL-2400,7.0,"Time left6d 13h left (Tue, 08:34)"
SONY VPL-ES1 DATA LCD MULTIMEDIA VIDEO PROJECTOR with Auto Tilt Feature,59.99,or Best Offer
LMP-H330 Lamp & Housing for Sony Projectors,75.29,Buy it now
