title,price,type
"SONY VPL-PX15 Data Projector XGA with Cables, & InstructionsCharity item",69.99,auction
GENUINE OEM JVC PK-L2313U BULB FOR DLA-VS2200 DLA-VS2200Z VS2200 VS2200Z 2LU,34.03,Buy it now
GENUINE OEM JVC PK-L2313U LAMP FOR DLA-VS2200 DLA-VS2200Z VS2200 VS2200Z 1LV,34.03,Buy it now
GENUINE OEM JVC PK-L2313U LAMP FOR DLA-VS2200 DLA-VS2200Z VS2200 VS2200Z 2LU,34.03,or Best Offer
GENUINE OEM JVC PK-L2313U BULB FOR DLA-VS2200 DLA-VS2200Z VS2200 VS2200Z 3LV,34.08,Buy it now
"BHL-5009-S Replacement Lamp for JVC Projectors DLA-HD10, DLA-RS2, DLA-VS2000",25.56,Was: £34.08  25% off
"GENUINE ORIGINAL OEM JVC PK-L2312U LAMP FOR DLA-RS4810U, DLA-X35 1LV",37.83,or Best Offer
Genuine OEM Epson Original Projector Bulb Lamp for JVC LX-D1020 with Housing,34.85,Was: £39.16  11% off
Genuine JVC BHL-5006-S Original Projector Lamp Bulb with Housing,37.51,Was: £42.14  11% off
RARE JVC RM-MQX1G Projector Remote Control Works With JVC DLA-QX1G & Others,66.28,Buy it now
JVC DLA-QX1G Original OEM Power Cable FREE SHIPPING,66.28,Buy it now
Genuine Epson Original Projector Lamp Bulb for JVC LX-D3000Z LX-D3000ZU Housing,58.79,Was: £66.05  11% off
jvc projector dlars4910 lca9034 good used pcb,65.34,or Best Offer
5 GENUINE OEM JVC PK-L2313U LAMPS FOR DLA-VS2200 DLA-VS2200Z VS2200 VS2200Z 2LU,94.51,or Best Offer
JVC DLA-X/RS Series Projector Chassis Parts White Conversion Kit,153.11,Buy it now
 Sony CPJ-200 LCD Projector Projector Analog RCA Speaker Small Rarity ,142.84,Buy it now
"Sony VLP-EX235 3029 Lamp Hours, Projector. Inc. Remote.",133.59,Buy it now
SONY VPL-CX5 2000 Lumen Projector 1534 Lamp hours used Tested With case & leads,69.99,or Best Offer
"Projector Video Projector SONY VPL-X600E, JAPAN",153.11,or Best Offer
projector lamp for SONY XL-2400,7.0,"Time left3d 15h left (Tue, 10:44)"
Sony VPL-DX122 XGA HDMI  Desktop Projector - 104 Hours Used.Excellent  Condition,100.0,or Best Offer
Sony KDS-R60XBR1 TV Assembly Cage with High Quality Projector bulb,23.67,or Best Offer
JVC DLA-RS1U Original inside lamp - Replaces BHL-5009-S,49.86,or Best Offer
