title,price,type
"BHL-5009-S Replacement Lamp for JVC Projectors DLA-HD10, DLA-RS2, DLA-VS2000",22.69,Was: £30.26  25% off
"New listingJVC DLA-HD100 - 1080P Home Cinema Projector - Read description - MSRP: £5,500",52.0,auction
New listingSONY PROJECTOR VPL-EX3 DATA LCD,19.99,auction
New listingSony Data Projector VPL-EX175Charity item,39.95,auction
New listingSony LCD Data Projector VPL-X600E. RRP£1100. ,14.99,auction
New listingSony VPL-CX76  Projector ,14.08,auction
New listingSony VPL-CX76  Projector ,25.0,"Time left6d 13h left (Mon, 08:19)"
New listingsony projector vpl -ES3,49.99,or Best Offer
SONY Projector with Bag & Leads & Remote,43.99,auction
SONY VPL-PX15 PROJECTOR for parts. Still works but not fully tested.,20.0,auction
Sony VPL-CS3 LCD Projector,20.0,auction
Sony VPL-CX5 Projector,39.0,auction
Sony Video Projector - VPL-EX7 - *ONLY 782 Lamp HOURS* From NEW - BRIGHT Image ,59.99,or Best Offer
