title,price,type
New listingSONY Projector with Bag & Leads & Remote,43.99,auction
New listingSONY VPL-PX15 PROJECTOR for parts. Still works but not fully tested.,20.0,auction
New listingSony VPL-CS3 LCD Projector,20.0,auction
New listingSony VPL-CX5 Projector,39.0,auction
New listingSony Video Projector - VPL-EX7 - *ONLY 782 Lamp HOURS* From NEW - BRIGHT Image ,59.99,or Best Offer
"SONY VSL- DS100 Data Projector  - Working, please read details carefully",29.99,Buy it now
Sony VPL CX21 Portable Projector,60.0,Buy it now
Sony VPL-EW275 WXGA HD Projector Brightness 3700 Lumens USB LAN HDMI VGA,120.0,Buy it now
"Sony VPL-FHZ65 Projector, White",6.5,auction
