title,price,type
JVC DLA-HD1 projector,150.0,auction
JVC DLA-QX1G D-ILA  Control Panel,159.55,Buy it now
JVC AV-P700 High Performance Visual Presenter 11x Power Zoom *Working*,133.97,Buy it now
JVC Reference Series 1080P RS-10u D-ILA Projector - works Great!!!,171.37,or Best Offer
JVC Visual Presenter AV-P700,139.61,or Best Offer
JVC DLA-RS1 807 Lamp Hours  Projector,191.46,Was: Previous price£239.33  20% off
JVC DLA-QX1G D-ILA  POWER SUB PB ASSY ,159.55,Buy it now
JVC DLA-QX1G D-ILA DPC PB  ASSY ,159.55,Buy it now
