title,price,type
 Sony CPJ-200 LCD Projector Projector Analog RCA Speaker Small Rarity ,114.0,Buy it now
Genuine JVC BHL-5006-S Original Projector Lamp Bulb with Housing,37.77,Was: £42.43  11% off
HD SONY VPL-DW126 3LCD PROJECTOR - 1080p/60 - HDMI,179.95,or Best Offer
JVC DLA-X/RS Series Projector Chassis Parts White Conversion Kit,153.02,Buy it now
New listingSony VPL-CX5 Projector,39.0,auction
New listingSony projector ,29.95,auction
Projector Lamp Sony VPL-VW11HT,150.0,"Time left9h 24m left (Sun, 04:16)"
"Projector Video Projector SONY VPL-X600E, JAPAN",153.02,or Best Offer
"SONY VPL-EX3 DATA LCD PROJECTOR CASE, CABLES",30.0,auction
SONY VPL-EX4 3 LCD PROJECTOR Desktop VGA Composite S Video NO REMOTE WorkingCharity item,44.95,"Time left2d 18h left (Tue, 13:10)"
Sony LCD Data Projector VPL-X600E. RRP£1100. ,17.99,auction
Sony Projector SVGA VPL-CS5,50.0,"Time left1d 14h left (Mon, 09:08)"
"Sony VLP-EX235 3029 Lamp Hours, Projector. Inc. Remote.",123.24,Buy it now
Sony VPL-CX76  Projector ,25.0,"Time left4d 12h left (Thu, 07:45)"
jvc projector dlars4910 lca9034 good used pcb,65.79,or Best Offer
