title,price,type
JVC D-ILA Projector DLA-RS1X Home Theater Rear Projector SEE PHOTOS,10.11,auction
"JVC Projector Ballast Repair Or Service. DLA-X3, X7,  X9, X30, X70, X90,",80.0,Buy it now
JVC D-ILA  DLA-S15U REAR CONFERENCE PROJECTOR MW1F,50.79,or Best Offer
JVC DLA-QX1G D-ILA  Control Panel,161.76,Buy it now
JVC DLA-QX1G D-ILA Control Panel,164.14,Buy it now
JVC DLA-QX1G D-ILA POWER SUB PB ASSY,164.14,Buy it now
JVC DLA-QX1G D-ILA DPC PB ASSY,164.14,Buy it now
JVC AV-P700 High Performance Visual Presenter 11x Power Zoom *Working*,135.83,Buy it now
JVC Reference Series 1080P RS-10u D-ILA Projector - works Great!!!,152.87,or Best Offer
JVC Visual Presenter AV-P700,141.55,or Best Offer
JVC DLA-RS1 807 Lamp Hours  Projector,181.98,Was: Previous price£242.64  25% off
JVC DLA-DS1 SXGA HD High Definition 720P 16:9 Widescreen Projector,115.5,or Best Offer
JVC DLA-QX1G D-ILA  POWER SUB PB ASSY ,161.76,Buy it now
JVC DLA-QX1G D-ILA DPC PB  ASSY ,161.76,Buy it now
