title,price,type
JVC D-ILA Projector DLA-RS1X Home Theater Rear Projector SEE PHOTOS,10.06,auction
New listingJVC DLA-X7000BE Projector,100.0,auction
JVC D-ILA  DLA-S15U REAR CONFERENCE PROJECTOR MW1F,50.53,or Best Offer
JVC DLA-QX1G D-ILA  Control Panel,160.93,Buy it now
JVC AV-P700 High Performance Visual Presenter 11x Power Zoom *Working*,135.13,Buy it now
JVC Reference Series 1080P RS-10u D-ILA Projector - works Great!!!,152.08,or Best Offer
JVC Visual Presenter AV-P700,140.82,or Best Offer
JVC DLA-RS1 807 Lamp Hours  Projector,181.04,Was: Previous price£241.39  25% off
JVC DLA-DS1 SXGA HD High Definition 720P 16:9 Widescreen Projector,114.91,or Best Offer
JVC DLA-QX1G D-ILA  POWER SUB PB ASSY ,160.93,Buy it now
JVC DLA-QX1G D-ILA DPC PB  ASSY ,160.93,Buy it now
