title,price,type
 Sony CPJ-200 LCD Projector Projector Analog RCA Speaker Small Rarity ,92.23,Buy it now
5 GENUINE OEM JVC PK-L2313U LAMPS FOR DLA-VS2200 DLA-VS2200Z VS2200 VS2200Z 2LU,93.68,or Best Offer
"BHL-5009-S Replacement Lamp for JVC Projectors DLA-HD10, DLA-RS2, DLA-VS2000",22.87,Was: £30.49  25% off
GENUINE OEM JVC PK-L2313U BULB FOR DLA-VS2200 DLA-VS2200Z VS2200 VS2200Z 2LU,33.73,Buy it now
GENUINE OEM JVC PK-L2313U BULB FOR DLA-VS2200 DLA-VS2200Z VS2200 VS2200Z 3LV,33.78,Buy it now
GENUINE OEM JVC PK-L2313U LAMP FOR DLA-VS2200 DLA-VS2200Z VS2200 VS2200Z 1LV,33.73,Buy it now
GENUINE OEM JVC PK-L2313U LAMP FOR DLA-VS2200 DLA-VS2200Z VS2200 VS2200Z 2LU,33.73,or Best Offer
Genuine Epson Original Projector Lamp Bulb for JVC LX-D3000Z LX-D3000ZU Housing,58.27,Was: £65.47  11% off
Genuine JVC BHL-5006-S Original Projector Lamp Bulb with Housing,37.18,Was: £41.77  11% off
Genuine OEM Epson Original Projector Bulb Lamp for JVC LX-D1020 with Housing,34.54,Was: £38.81  11% off
Genuine OEM JVC PK-L3715U1 PK-L3715UW Projector Lamp Bulb With Housing Original,132.41,Was: £148.77  11% off
JVC DLA-QX1G Original OEM Power Cable FREE SHIPPING,63.79,Buy it now
JVC DLA-X/RS Series Projector Chassis Parts White Conversion Kit,152.7,Buy it now
New listingSONY DATA PROJECTOR VPL-CX70 NOT TESTED,18.0,auction
New listingWXGA Conference Room Projector | SONY VPL-FW41 |,140.03,Buy it now
OEM SONY VPLL-ZM42 Projection Lens for the VPL-F Series Projectors,93.85,Buy it now
"Projector Video Projector SONY VPL-X600E, JAPAN",152.7,or Best Offer
RARE JVC RM-MQX1G Projector Remote Control Works With JVC DLA-QX1G & Others,63.79,Buy it now
Sony SVGA VPL-CS2 Projector with carry case accessories 498 Lamp hours used,54.99,or Best Offer
Sony VPL-CX76  Projector ,25.0,"Time left4d 13h left (Mon, 08:19)"
Sony WXGA VPL- FW300L Projector Cooling Fans,70.4,or Best Offer
jvc projector dlars4910 lca9034 good used pcb,64.77,or Best Offer
