title,price,type
PROJECTOR JVC L1561 Original inside lamp - BHL-5009,49.85,or Best Offer
PROJECTOR JVC L1561 Original inside lamp - BHL-5009,49.85,or Best Offer
PROJECTOR LAMP DT00661 ALDA PQ LAMP WITH HOUSING.,49.85,or Best Offer
JVC DLA-RS1U Original inside lamp - Replaces BHL-5009-S,49.85,or Best Offer
"BHL-5009-S Replacement Lamp for JVC Projectors DLA-HD10, DLA-RS2, DLA-VS2000",28.91,Was: Previous price£34.01  15% off
JVC DLA-RS1U Original inside lamp - Replaces BHL-5009-S,49.86,or Best Offer
