title,price,type
 Sony CPJ-200 LCD Projector Projector Analog RCA Speaker Small Rarity ,100.72,Buy it now
5 GENUINE OEM JVC PK-L2313U LAMPS FOR DLA-VS2200 DLA-VS2200Z VS2200 VS2200Z 2LU,94.88,or Best Offer
"BHL-5009-S Replacement Lamp for JVC Projectors DLA-HD10, DLA-RS2, DLA-VS2000",25.66,Was: £34.22  25% off
GENUINE OEM JVC PK-L2313U BULB FOR DLA-VS2200 DLA-VS2200Z VS2200 VS2200Z 2LU,34.17,Buy it now
GENUINE OEM JVC PK-L2313U BULB FOR DLA-VS2200 DLA-VS2200Z VS2200 VS2200Z 3LV,34.22,Buy it now
GENUINE OEM JVC PK-L2313U LAMP FOR DLA-VS2200 DLA-VS2200Z VS2200 VS2200Z 1LV,34.17,Buy it now
GENUINE OEM JVC PK-L2313U LAMP FOR DLA-VS2200 DLA-VS2200Z VS2200 VS2200Z 2LU,34.17,or Best Offer
Genuine Epson Original Projector Lamp Bulb for JVC LX-D3000Z LX-D3000ZU Housing,59.02,Was: £66.31  11% off
Genuine JVC BHL-5006-S Original Projector Lamp Bulb with Housing,37.66,Was: £42.31  11% off
Genuine OEM Epson Original Projector Bulb Lamp for JVC LX-D1020 with Housing,34.99,Was: £39.31  11% off
JVC DLA-QX1G Original OEM Power Cable FREE SHIPPING,66.54,Buy it now
JVC DLA-X/RS Series Projector Chassis Parts White Conversion Kit,153.13,Buy it now
New listingHD SONY VPL-DW126 3LCD PROJECTOR - 1080p/60 - HDMI,159.95,Buy it now
"New listingSony LCD Data Projector VPL-EX100 White - Tested & Working, No Remote, DiscIncl",55.5,or Best Offer
New listingSony VPL-CX76  Projector ,11.5,auction
New listingsony vpl-px40 super bright home cinema/data business projector & extras,70.0,Buy it now
OEM SONY VPLL-ZM42 Projection Lens for the VPL-F Series Projectors,95.06,Buy it now
"Projector Video Projector SONY VPL-X600E, JAPAN",153.13,or Best Offer
RARE JVC RM-MQX1G Projector Remote Control Works With JVC DLA-QX1G & Others,66.54,Buy it now
SONY VPL-CS6 LCD DATA PROJECTOR + CONNECTION CABLES & Remote,30.0,Buy it now
SONY VPL-CX5 2000 Lumen Projector 926 Lamp hours used Working & Tested,69.99,or Best Offer
SONY VW320ES 4K Projector LCD PANEL SXRD851 C(GQ),114.08,Buy it now
Sony VPL-EX3 Video Projector Transperent Lens,11.36,Buy it now
Sony VPL-PX1 Projector DATA Projector,68.52,auction
Sony WXGA VPL- FW300L Projector Cooling Fans,71.3,or Best Offer
jvc projector dlars4910 lca9034 good used pcb,65.6,or Best Offer
