title,price,type
 Sony CPJ-200 LCD Projector Projector Analog RCA Speaker Small Rarity ,113.89,Buy it now
" projector vpl-Sony Black, desk top. Short throw projection affordable quality.",45.99,Buy it now
5 GENUINE OEM JVC PK-L2313U LAMPS FOR DLA-VS2200 DLA-VS2200Z VS2200 VS2200Z 2LU,95.15,or Best Offer
"BHL-5009-S Replacement Lamp for JVC Projectors DLA-HD10, DLA-RS2, DLA-VS2000",25.73,Was: £34.31  25% off
GENUINE OEM JVC PK-L2313U BULB FOR DLA-VS2200 DLA-VS2200Z VS2200 VS2200Z 2LU,34.27,Buy it now
GENUINE OEM JVC PK-L2313U BULB FOR DLA-VS2200 DLA-VS2200Z VS2200 VS2200Z 3LV,34.31,Buy it now
GENUINE OEM JVC PK-L2313U LAMP FOR DLA-VS2200 DLA-VS2200Z VS2200 VS2200Z 1LV,34.27,Buy it now
GENUINE OEM JVC PK-L2313U LAMP FOR DLA-VS2200 DLA-VS2200Z VS2200 VS2200Z 2LU,34.27,or Best Offer
"GENUINE ORIGINAL OEM JVC PK-L2312U LAMP FOR DLA-RS4810U, DLA-X35 1LV",38.09,or Best Offer
Genuine Epson Original Projector Lamp Bulb for JVC LX-D3000Z LX-D3000ZU Housing,59.19,Was: £66.50  11% off
Genuine JVC BHL-5006-S Original Projector Lamp Bulb with Housing,37.76,Was: £42.43  11% off
Genuine OEM Epson Original Projector Bulb Lamp for JVC LX-D1020 with Housing,35.09,Was: £39.42  11% off
JVC DLA-QX1G Original OEM Power Cable FREE SHIPPING,66.73,Buy it now
JVC DLA-X/RS Series Projector Chassis Parts White Conversion Kit,152.88,Buy it now
New listingSony LCD Data Projector VPL-X600E. RRP£1100. ,17.99,auction
Projector Lamp Sony VPL-VW11HT,150.0,"Time left1d 9h left (Sun, 04:16)"
"Projector Video Projector SONY VPL-X600E, JAPAN",152.88,or Best Offer
RARE JVC RM-MQX1G Projector Remote Control Works With JVC DLA-QX1G & Others,66.73,Buy it now
SONY VPL-EX4 3 LCD PROJECTOR Desktop VGA Composite S Video NO REMOTE WorkingCharity item,44.95,"Time left3d 18h left (Tue, 13:10)"
"SONY VPL-PX15 Data Projector XGA with Cables, & InstructionsCharity item",44.99,auction
SONY VW320ES 4K Projector LCD PANEL SXRD851 C(GQ),114.41,Buy it now
Sony LCD Data Projector Installation Guide VPL series,1.18,auction
Sony Projector SVGA VPL-CS5,50.0,"Time left2d 14h left (Mon, 09:08)"
"Sony VLP-EX235 3029 Lamp Hours, Projector. Inc. Remote.",123.13,Buy it now
Sony VPL-CX76  Projector ,11.5,auction
Sony VPL-CX76  Projector ,14.08,auction
Sony VPL-CX76  Projector ,25.0,"Time left5d 12h left (Thu, 07:45)"
Sony WXGA VPL- FW300L Projector Cooling Fans,71.51,or Best Offer
jvc projector dlars4910 lca9034 good used pcb,65.78,or Best Offer
