title,price,type
JVC Projector. DLA-X30WE. HDMI. Working. Read description.,27.0,auction
New listing Sony CPJ-200 LCD Projector Projector Analog RCA Speaker Small Rarity ,132.18,Buy it now
New listingSONY VPL-CS4 LCD DATA PROJECTOR + CONNECTION CABLES - IN GOOD WORKING CONDITION.,20.0,auction
New listingSONY VPL-EX4 3 LCD PROJECTOR Desktop VGA Composite S Video NO REMOTE WorkingCharity item,44.95,or Best Offer
New listingSony Data Projector VPL - EX226,75.0,auction
New listingSony VPL CS6 LED Data Projector With Remote & Case,10.0,auction
Projector Lamp Sony VPL-VW11HT,70.0,auction
Projector Lamp Sony VPL-VW11HT,150.0,"Time left5d 9h left (Sun, 04:15)"
SONY Projector with Bag & Leads & Remote,43.99,auction
SONY VPL-PX15 PROJECTOR for parts. Still works but not fully tested.,20.0,auction
Sony Cineza Projector System,150.0,Buy it now
Sony Cineza VPL HS60 Projector with Controller And Ceiling Mount,110.0,or Best Offer
Sony Data Projector VPL-DX11 With Case,15.0,auction
Sony VPL-CS3 LCD Projector,35.0,auction
Sony VPL-CX5 Projector,45.0,auction
projector lamp for SONY XL-2400,7.0,"Time left1d 11h left (Wed, 06:32)"
