title,price,type
New listingJVC DLA-RS3000K / DLA-NX9 8K e-shift Projector with Brand New Extra Bulb Bundle,11.73,auction
New listingJVC DLA-RS3000K / DLA-NX9 2200 8k-e-shift D-ILA Projector + Extra Bulb,2.92,auction
New listingJVC DLA-RS3000K   DLA-NX9 2200 lumens 8k-e-shift D-ILA Home Theater Projector,12.26,auction
New listingJVC DLA-NX9,13.35,auction
New listingJVC DLA-NX7 2160p D-ILA Home Projector w Extra Bulb - Slightly Used!,13.44,auction
"JVC Projector Ballast Repair Or Service. DLA-X3, X7,  X9, X30, X70, X90,",80.0,Buy it now
JVC DLA-QX1G D-ILA  Control Panel,162.17,Buy it now
JVC DLA-QX1G D-ILA Control Panel,164.32,Buy it now
JVC DLA-QX1G D-ILA POWER SUB PB ASSY,164.32,Buy it now
JVC DLA-QX1G D-ILA DPC PB ASSY,164.32,Buy it now
JVC AV-P700 High Performance Visual Presenter 11x Power Zoom *Working*,136.17,Buy it now
JVC Reference Series 1080P RS-10u D-ILA Projector - works Great!!!,174.17,or Best Offer
JVC Visual Presenter AV-P700,141.9,or Best Offer
JVC DLA-RS1 807 Lamp Hours  Projector,194.6,Was: Previous price£243.25  20% off
JVC DLA-QX1G D-ILA DPC PB  ASSY ,162.17,Buy it now
JVC DLA-QX1G D-ILA  POWER SUB PB ASSY ,162.17,Buy it now
