title,price,type
BHL-5006 lamp / bulb for JVC projector. BHL5006,15.0,Buy it now
Dla-G10-Lamp Jvc...,22.0,or Best Offer
GENUINE OEM JVC PK-L2313U BULB FOR DLA-VS2200 DLA-VS2200Z VS2200 VS2200Z 2LU,33.92,Buy it now
GENUINE OEM JVC PK-L2313U LAMP FOR DLA-VS2200 DLA-VS2200Z VS2200 VS2200Z 2LU,33.92,or Best Offer
GENUINE OEM JVC PK-L2313U LAMP FOR DLA-VS2200 DLA-VS2200Z VS2200 VS2200Z 1LV,33.92,Buy it now
GENUINE OEM JVC PK-L2313U BULB FOR DLA-VS2200 DLA-VS2200Z VS2200 VS2200Z 3LV,33.96,Buy it now
PROJECTOR JVC L1561 Original inside lamp - BHL-5009,49.85,or Best Offer
PROJECTOR JVC L1561 Original inside lamp - BHL-5009,49.85,or Best Offer
PROJECTOR LAMP DT00661 ALDA PQ LAMP WITH HOUSING.,49.85,or Best Offer
JVC DLA-RS1U Original inside lamp - Replaces BHL-5009-S,49.85,or Best Offer
"GENUINE ORIGINAL OEM JVC PK-L2312U LAMP FOR DLA-RS4810U, DLA-X35 1LV",37.7,or Best Offer
"BHL-5009-S Replacement Lamp for JVC Projectors DLA-HD10, DLA-RS2, DLA-VS2000",27.17,Was: Previous price£33.96  20% off
Genuine OEM Epson Original Projector Bulb Lamp for JVC LX-D1020 with Housing,34.73,Was: Previous price£39.02  11% off
Genuine JVC BHL-5006-S Original Projector Lamp Bulb with Housing,37.38,Was: Previous price£41.99  11% off
"JVC Projector Ballast Repair Or Service. DLA-X3, X7,  X9, X30, X70, X90,",80.0,Buy it now
RARE JVC RM-MQX1G Projector Remote Control Works With JVC DLA-QX1G & Others,66.05,Buy it now
JVC DLA-QX1G Original OEM Power Cable FREE SHIPPING,66.05,Buy it now
Genuine Epson Original Projector Lamp Bulb for JVC LX-D3000Z LX-D3000ZU Housing,58.58,Was: Previous price£65.82  11% off
JVC Projector 3D Kit. PK-EM1 Emitter & 4 Pairs PK-AG1 Glasses,89.99,or Best Offer
5 GENUINE OEM JVC PK-L2313U LAMPS FOR DLA-VS2200 DLA-VS2200Z VS2200 VS2200Z 2LU,94.18,or Best Offer
JVC projector Bulb Lamp DLA-X500R x700 x900 genuine bulb with housing,119.0,or Best Offer
jvc projector dlars4910 lca9034 good used pcb,92.48,or Best Offer
JVC DLA-X/RS Series Projector Chassis Parts White Conversion Kit,154.85,Buy it now
JVC DLA-RS1U Original inside lamp - Replaces BHL-5009-S,49.86,or Best Offer
BHL-5002SU Lamp with Housing,23.59,or Best Offer
"GENUINE OEM JVC PK-L2312U LAMP FOR DLA-X75R, DLA-RS66, DLA-X95R, DLA-RS66U 1MV",37.7,or Best Offer
"GENUINE OEM JVC PK-L2312U LAMP FOR DLA-RS56, DLA-RS56U, DLA-RS4810, DLA-RS46 1LV",37.7,or Best Offer
"GENUINE OEM JVC PK-L2312U LAMP FOR DLA-RS46U, DLA-X35B, DLA-X35W, DLA-X55R 1LV",37.7,or Best Offer
"GENUINE OEM JVC PK-L2312U LAMP FOR DLA-X75R, DLA-RS66, DLA-X95R, DLA-RS66U 1LV",37.7,or Best Offer
"GENUINE OEM JVC PK-L2312U LAMP FOR DLA-RS56, DLA-RS56U, DLA-RS4810, DLA-RS46 1MV",37.7,or Best Offer
"GENUINE ORIGINAL OEM JVC PK-L2312U LAMP FOR DLA-RS4810U, DLA-X35 1MV",37.7,or Best Offer
"GENUINE OEM JVC PK-L2312U LAMP FOR DLA-RS46U, DLA-X35B, DLA-X35W, DLA-X55R 1MV",37.7,or Best Offer
