title,price,type
"JVC DLA-HD950 Black, HD Projector, High contrast, THX certified, 10m HDMI cable",325.0,"0 bids 路 Time left13h 14m left (Sat, 08:19)"
JVC D-ILA REFERENCE SERIES PROJECTOR ,900.0,"0 bids 路 Time left17h 11m left (Sat, 12:17)"
JVC D-ILA REFERENCE SERIES PROJECTOR ,950.0,"0 bids 路 Time left1d 16h left (Sun, 12:00)"
"JVC DLA-X7-BE Projector, 3D, With Remote Control, Fully Working",350.0,"0 bids 路 Time left1d 17h left (Sun, 12:18)"
JVC DLA 3D projector X90RBE With Screen stand & 3D glasses,1250.0,"0 bids 路 Time left2d 8h left (Mon, 03:18)"
JVC DLA-X7000BE Projector,310.0,"14 bids 路 Time left2d 18h left (Mon, 13:40)"
New listingJVC Projector DLA-X7500 BE - Only 166 lamp hours - 8 x 3d glasses 3D Synchro,1500.0,"0 bids 路 Time left4d 15h left (Wed, 11:00)"
New listingJVC DLA PROJECTOR W/ REPLACEMENT LAMP,2006.34,"0 bids 路 Time left6d 3h left (Thu, 22:59)"
New listingJVC projector DLA-X500RBE,950.0,"0 bids 路 Time left6d 7h left (Fri, 02:38)"
