title,price,type
"JVC D-ILA- DLA-X9-BU SERIES PROJECTOR w/ extra Bulb, Remote & Power Cord",808.83,"0 bids 路 Time left1d 14h left (Thu, 09:39)"
JVC D-ILA Projector DLA-RS1X Home Theater Rear Projector SEE PHOTOS,10.11,+ 20% VAT will apply
JVC DLA PROJECTOR W/ REPLACEMENT LAMP,2021.27,"0 bids 路 Time left2d 3h left (Thu, 22:58)"
JVC Projector DLA-X7500 BE - Only 166 lamp hours - 8 x 3d glasses 3D Synchro,2000.0,"0 bids 路 Time left2d 15h left (Fri, 11:00)"
"JVC DLA-HD950 Black, HD Projector, High contrast, THX certified, 10m HDMI cable",325.0,"0 bids 路 Time left3d 13h left (Sat, 08:19)"
JVC D-ILA REFERENCE SERIES PROJECTOR ,900.0,"0 bids 路 Time left3d 17h left (Sat, 12:17)"
JVC D-ILA REFERENCE SERIES PROJECTOR ,950.0,"0 bids 路 Time left4d 16h left (Sun, 12:00)"
"JVC DLA-X7-BE Projector, 3D, With Remote Control, Fully Working",350.0,"0 bids 路 Time left4d 17h left (Sun, 12:18)"
JVC DLA 3D projector X90RBE With Screen stand & 3D glasses,1250.0,"0 bids 路 Time left5d 8h left (Mon, 03:18)"
