title,price,type
BHL-5006 lamp / bulb for JVC projector. BHL5006,15.0,Buy it now
Dla-G10-Lamp Jvc...,22.0,or Best Offer
GENUINE OEM JVC PK-L2313U LAMP FOR DLA-VS2200 DLA-VS2200Z VS2200 VS2200Z 2LU,34.01,or Best Offer
GENUINE OEM JVC PK-L2313U BULB FOR DLA-VS2200 DLA-VS2200Z VS2200 VS2200Z 2LU,34.01,Buy it now
GENUINE OEM JVC PK-L2313U LAMP FOR DLA-VS2200 DLA-VS2200Z VS2200 VS2200Z 1LV,34.01,Buy it now
GENUINE OEM JVC PK-L2313U BULB FOR DLA-VS2200 DLA-VS2200Z VS2200 VS2200Z 3LV,34.05,Buy it now
PROJECTOR JVC L1561 Original inside lamp - BHL-5009,49.85,or Best Offer
PROJECTOR JVC L1561 Original inside lamp - BHL-5009,49.85,or Best Offer
PROJECTOR LAMP DT00661 ALDA PQ LAMP WITH HOUSING.,49.85,or Best Offer
JVC DLA-RS1U Original inside lamp - Replaces BHL-5009-S,49.85,or Best Offer
"GENUINE ORIGINAL OEM JVC PK-L2312U LAMP FOR DLA-RS4810U, DLA-X35 1LV",37.8,or Best Offer
"New listingBHL-5009-S Replacement Lamp for JVC Projectors DLA-HD10, DLA-RS2, DLA-VS2000",34.05,or Best Offer
Genuine OEM Epson Original Projector Bulb Lamp for JVC LX-D1020 with Housing,34.82,Was: Previous price£39.12  11% off
Genuine JVC BHL-5006-S Original Projector Lamp Bulb with Housing,37.48,Was: Previous price£42.11  11% off
Victor BHL5010-S Projector Lamp Unit for JVC DLA; LV 6101321,15.57,Was: Previous price£20.77  25% off
JVC D-ILA Projector 3D Syncro Emitter (PK-EM1),55.82,Buy it now
"JVC Projector Ballast Repair Or Service. DLA-X3, X7,  X9, X30, X70, X90,",80.0,Buy it now
RARE JVC RM-MQX1G Projector Remote Control Works With JVC DLA-QX1G & Others,66.22,Buy it now
JVC DLA-QX1G Original OEM Power Cable FREE SHIPPING,66.22,Buy it now
Genuine Epson Original Projector Lamp Bulb for JVC LX-D3000Z LX-D3000ZU Housing,58.74,Was: Previous price£66.00  11% off
JVC Projector PK-EM1 3D Emitter & 4 Pairs PK-AG1 Glasses,100.0,Buy it now
5 GENUINE OEM JVC PK-L2313U LAMPS FOR DLA-VS2200 DLA-VS2200Z VS2200 VS2200Z 2LU,94.43,or Best Offer
JVC projector Bulb Lamp DLA-X500R x700 x900 genuine bulb with housing,119.0,or Best Offer
jvc projector dlars4910 lca9034 good used pcb,92.73,or Best Offer
JVC DLA-X/RS Series Projector Chassis Parts White Conversion Kit,154.81,Buy it now
"GENUINE OEM JVC PK-L2312U LAMP FOR DLA-X75R, DLA-RS66, DLA-X95R, DLA-RS66U 1MV",37.8,or Best Offer
JVC DLA-RS1U Original inside lamp - Replaces BHL-5009-S,49.86,or Best Offer
BHL-5002SU Lamp with Housing,23.65,or Best Offer
"GENUINE OEM JVC PK-L2312U LAMP FOR DLA-X75R, DLA-RS66, DLA-X95R, DLA-RS66U 1LV",37.8,or Best Offer
"GENUINE ORIGINAL OEM JVC PK-L2312U LAMP FOR DLA-RS4810U, DLA-X35 1MV",37.8,or Best Offer
"GENUINE OEM JVC PK-L2312U LAMP FOR DLA-RS46U, DLA-X35B, DLA-X35W, DLA-X55R 1LV",37.8,or Best Offer
"GENUINE OEM JVC PK-L2312U LAMP FOR DLA-RS46U, DLA-X35B, DLA-X35W, DLA-X55R 1MV",37.8,or Best Offer
"GENUINE OEM JVC PK-L2312U LAMP FOR DLA-RS56, DLA-RS56U, DLA-RS4810, DLA-RS46 1MV",37.8,or Best Offer
"GENUINE OEM JVC PK-L2312U LAMP FOR DLA-RS56, DLA-RS56U, DLA-RS4810, DLA-RS46 1LV",37.8,or Best Offer
