title,price,type
"JVC Projector Ballast Repair Or Service. DLA-X3, X7,  X9, X30, X70, X90,",80.0,Buy it now
JVC DLA-QX1G D-ILA  Control Panel,160.42,Buy it now
JVC DLA-QX1G D-ILA Control Panel,164.32,Buy it now
JVC DLA-QX1G D-ILA POWER SUB PB ASSY,164.32,Buy it now
JVC DLA-QX1G D-ILA DPC PB ASSY,164.32,Buy it now
JVC Reference Series 1080P RS-10u D-ILA Projector - works Great!!!,181.93,or Best Offer
JVC Visual Presenter AV-P700,140.38,or Best Offer
JVC DLA-QX1G D-ILA  POWER SUB PB ASSY ,160.42,Buy it now
JVC DLA-QX1G D-ILA DPC PB  ASSY ,160.42,Buy it now
